{
  "metadata": {
    "invoice_number": "RE-2025-001",
    "invoice_date": "22.01.2025",
    "due_date": "05.02.2025",
    "customer_number": "K-001"
  },
  "recipient": {
    "name": "Thomas Beispiel",
    "company": "Beispiel & Partner Steuerberatung",
    "address": {
      "street": "Musterplatz",
      "house_number": "15",
      "postal_code": "12345",
      "city": "Musterstadt"
    }
  },
  "items": [
    {
      "description": "Webentwicklung - Responsive Website Redesign\nNeugestaltung der Unternehmenswebsite mit modernem Design, optimiert für Desktop, Tablet und Mobile",
      "quantity": 32,
      "unit": "Stunden",
      "unit_price": "95,00 EUR",
      "total_price": "3.040,00 EUR"
    },
    {
      "description": "Backend-Entwicklung - Kontaktformular mit E-Mail-Integration\nPHP-Backend mit Spam-Schutz und automatischer Bestätigungsmail",
      "quantity": 8,
      "unit": "Stunden",
      "unit_price": "95,00 EUR",
      "total_price": "760,00 EUR"
    },
    {
      "description": "Content-Migration\nÜbernahme und Aufbereitung bestehender Inhalte inkl. SEO-Optimierung",
      "quantity": 6,
      "unit": "Stunden",
      "unit_price": "85,00 EUR",
      "total_price": "510,00 EUR"
    },
    {
      "description": "Webhosting Setup (1 Jahr)\nManaged Hosting inkl. SSL-Zertifikat, tägliche Backups, 99.9% Uptime",
      "quantity": 1,
      "unit": "Pauschal",
      "unit_price": "299,00 EUR",
      "total_price": "299,00 EUR"
    }
  ],
  "totals": {
    "subtotal": "4.609,00 EUR",
    "tax_rate": "19%",
    "tax_amount": "875,71 EUR",
    "total": "5.484,71 EUR"
  },
  "notes": "Vielen Dank für Ihr Vertrauen! Bei Fragen zur Rechnung erreichen Sie uns unter buchhaltung@digital-solutions.de",
  "terms": null
}
